{
  "property_name": null,
  "address": null,
  "city": null,
  "state": null,
  "asset_type": "office",
  "size": null,
  "units": null,
  "year_built": null,
  "owner": null,
  "manager": null,
  "broker": "Capital Markets",
  "lender": "financing",
  "tenant": null,
  "listing_status": "available",
  "asking_price": null,
  "sale_price": null,
  "cap_rate": null,
  "NOI": null,
  "occupancy": "Occupancy",
  "lease_expiration": null,
  "debt_maturity": null,
  "distress_signal": null,
  "disposition_signal": "acquisition",
  "source_url": "https://www.jll.com/en-us/insights",
  "source_type": "brokerage research",
  "document_url": null,
  "extracted_text_snippet": "### Global office fit-out costs guide 2026",
  "confidence_score": 0.55,
  "crawl_date": "2026-05-09T08:17:34.086678+00:00",
  "compliance_notes": "partial_public; robots=allowed; robots_url=https://www.jll.com/robots.txt; no login/paywall/CAPTCHA bypass attempted."
}