{
  "property_name": null,
  "address": null,
  "city": null,
  "state": null,
  "asset_type": "Data Center",
  "size": null,
  "units": null,
  "year_built": null,
  "owner": null,
  "manager": null,
  "broker": "Capital Markets",
  "lender": "loan",
  "tenant": "lease",
  "listing_status": null,
  "asking_price": "$650M",
  "sale_price": null,
  "cap_rate": null,
  "NOI": null,
  "occupancy": null,
  "lease_expiration": null,
  "debt_maturity": "maturity",
  "distress_signal": "Foreclosure",
  "disposition_signal": null,
  "source_url": "https://www.bisnow.com/",
  "source_type": "CRE news",
  "document_url": null,
  "extracted_text_snippet": "[![Placeholder](https://cdn.bisnow.net/assets/website/placeholder.png)](https://www.bisnow.com/boston/news/office/assembly-investments-401-wash-studiob-133925)",
  "confidence_score": 0.59,
  "crawl_date": "2026-05-09T08:17:34.086678+00:00",
  "compliance_notes": "partial_public; robots=allowed; robots_url=https://www.bisnow.com/robots.txt; no login/paywall/CAPTCHA bypass attempted."
}