{
  "property_name": null,
  "address": null,
  "city": null,
  "state": null,
  "asset_type": "mixed-use",
  "size": null,
  "units": null,
  "year_built": null,
  "owner": null,
  "manager": null,
  "broker": null,
  "lender": null,
  "tenant": null,
  "listing_status": null,
  "asking_price": "$5.0 Billion",
  "sale_price": null,
  "cap_rate": null,
  "NOI": "NOI",
  "occupancy": null,
  "lease_expiration": null,
  "debt_maturity": null,
  "distress_signal": null,
  "disposition_signal": null,
  "source_url": "https://investors.simon.com/",
  "source_type": "REIT investor relations",
  "document_url": null,
  "extracted_text_snippet": "[Accolades & Research](https://investors.simon.com/news-events/accolades-research \"Learn how Simon has outperformed the market, led the competition & racked up many an award. \")",
  "confidence_score": 0.68,
  "crawl_date": "2026-05-09T08:17:34.086678+00:00",
  "compliance_notes": "approved_public; robots=unknown; robots_url=https://investors.simon.com/robots.txt (HTTPSConnectionPool(host='investors.simon.com', port=443): Read timed out. (read timeout=8)); no login/paywall/CAPTCHA bypass attempted."
}