{
  "property_name": null,
  "address": "9401 Knight Road",
  "city": null,
  "state": null,
  "asset_type": "Office",
  "size": null,
  "units": null,
  "year_built": null,
  "owner": null,
  "manager": null,
  "broker": null,
  "lender": "financing",
  "tenant": null,
  "listing_status": "auction",
  "asking_price": "$5.00",
  "sale_price": null,
  "cap_rate": null,
  "NOI": null,
  "occupancy": null,
  "lease_expiration": null,
  "debt_maturity": null,
  "distress_signal": "tax sale",
  "disposition_signal": "Sale",
  "source_url": "https://www.hctax.net/Property/TaxSales",
  "source_type": "tax sale",
  "document_url": null,
  "extracted_text_snippet": "[Skip to main content](https://www.hctax.net/Property/TaxSales#main-content)",
  "confidence_score": 0.59,
  "crawl_date": "2026-05-09T08:17:34.086678+00:00",
  "compliance_notes": "partial_public; robots=allowed; robots_url=https://www.hctax.net/robots.txt; no login/paywall/CAPTCHA bypass attempted."
}