{
  "property_name": null,
  "address": "600 Commerce Street",
  "city": null,
  "state": null,
  "asset_type": "Office",
  "size": null,
  "units": null,
  "year_built": null,
  "owner": null,
  "manager": null,
  "broker": null,
  "lender": "Mortgage",
  "tenant": null,
  "listing_status": "sold",
  "asking_price": "$1.00",
  "sale_price": null,
  "cap_rate": null,
  "NOI": null,
  "occupancy": null,
  "lease_expiration": null,
  "debt_maturity": null,
  "distress_signal": "Foreclosure",
  "disposition_signal": "sale",
  "source_url": "https://www.dallascounty.org/government/county-clerk/foreclosures.php",
  "source_type": "foreclosure notices",
  "document_url": null,
  "extracted_text_snippet": "all Foreclosure Postings and Sales will take place on the North Side of the George Allen Courts Building Facing Commerce Street below the overhang, or as designated by the County Commissioners. The earliest time the sale will begin is 10:00am, but no later than three hours after such time.",
  "confidence_score": 0.9,
  "crawl_date": "2026-05-09T08:17:34.086678+00:00",
  "compliance_notes": "approved_public; robots=allowed; robots_url=https://www.dallascounty.org/robots.txt; no login/paywall/CAPTCHA bypass attempted."
}