{
  "property_name": null,
  "address": null,
  "city": null,
  "state": null,
  "asset_type": "office",
  "size": null,
  "units": null,
  "year_built": null,
  "owner": null,
  "manager": null,
  "broker": null,
  "lender": null,
  "tenant": "lease",
  "listing_status": null,
  "asking_price": null,
  "sale_price": null,
  "cap_rate": null,
  "NOI": null,
  "occupancy": null,
  "lease_expiration": null,
  "debt_maturity": null,
  "distress_signal": null,
  "disposition_signal": null,
  "source_url": "https://www.cushmanwakefield.com/en/united-states/insights/us-marketbeats/us-capital-markets-marketbeat",
  "source_type": "brokerage research",
  "document_url": null,
  "extracted_text_snippet": "Share: [_Share on Facebook_](https://www.facebook.com/sharer.php?t=U.S.%20MarketBeats%20Real%20Estate%20Research%20Data%20%7C%20US%20%7C%20Cushman%20%26%20Wakefield&u=https://www.cushmanwakefield.com/en/united-states/insights/us-marketbeats)",
  "confidence_score": 0.43,
  "crawl_date": "2026-05-09T08:17:34.086678+00:00",
  "compliance_notes": "partial_public; robots=allowed; robots_url=https://www.cushmanwakefield.com/robots.txt; no login/paywall/CAPTCHA bypass attempted."
}