{
  "property_name": null,
  "address": null,
  "city": null,
  "state": null,
  "asset_type": "Hospitality",
  "size": null,
  "units": null,
  "year_built": null,
  "owner": null,
  "manager": null,
  "broker": null,
  "lender": null,
  "tenant": "Lease",
  "listing_status": null,
  "asking_price": null,
  "sale_price": null,
  "cap_rate": null,
  "NOI": null,
  "occupancy": null,
  "lease_expiration": null,
  "debt_maturity": null,
  "distress_signal": null,
  "disposition_signal": null,
  "source_url": "https://www.marcusmillichap.com/research",
  "source_type": "brokerage research",
  "document_url": null,
  "extracted_text_snippet": "Marcus & Millichap's research services division is dedicated to providing our clients with cutting-edge market research and innovative insights. We produce research reports and videos covering over a dozen property types, across the United States and Canada, and a variety of market conditions, all to help our clients make better, more informed decisions.",
  "confidence_score": 0.65,
  "crawl_date": "2026-05-09T08:17:34.086678+00:00",
  "compliance_notes": "approved_public; robots=allowed; robots_url=https://www.marcusmillichap.com/robots.txt; no login/paywall/CAPTCHA bypass attempted."
}